[
  {
    "type": "com.mbta.ctd.glides.vehicle_trip_assignments.v1",
    "specversion": "1.0",
    "source": "glides.mbta.com",
    "id": "19fdb184-7dd6-4664-8472-04bd6177ec44",
    "time": "2024-11-14T09:50:00-04:00",
    "data": {
      "assignments": [
        {
          "vehicle": {
            "vehicleId": "G-12345",
            "carNumbers": ["3901", "3902"]
          },
          "tripKey": null
        }
      ]
    }
  },
  {
    "type": "com.mbta.ctd.glides.vehicle_trip_assignments.v1",
    "specversion": "1.0",
    "source": "glides.mbta.com",
    "id": "19fdb184-7dd6-4664-8472-04bd6177ec44",
    "time": "2024-11-14T10:00:00-04:00",
    "data": {
      "assignments": [
        {
          "vehicle": {
            "vehicleId": "G-12345",
            "carNumbers": ["3901", "3902"]
          },
          "tripKey": {
            "serviceDate": "2024-11-14",
            "tripId": "11111111",
            "scheduled": "scheduled",
            "revenue": "revenue"
          }
        }
      ]
    }
  },
  {
    "type": "com.mbta.ctd.glides.vehicle_trip_assignments.v1",
    "specversion": "1.0",
    "source": "glides.mbta.com",
    "id": "19fdb184-7dd6-4664-8472-04bd6177ec44",
    "time": "2024-11-14T10:55:00-04:00",
    "data": {
      "assignments": [
        {
          "vehicle": {
            "vehicleId": "G-12345",
            "carNumbers": ["3901", "3902"]
          },
          "tripKey": {
            "serviceDate": "2024-11-14",
            "tripId": "22222222",
            "scheduled": "scheduled",
            "revenue": "revenue"
          }
        },
        {
          "vehicle": null,
          "tripKey": {
            "serviceDate": "2024-11-14",
            "tripId": "11111111",
            "scheduled": "scheduled",
            "revenue": "revenue"
          }
        }
      ]
    }
  },
  {
    "type": "com.mbta.ctd.glides.vehicle_trip_assignments.v1",
    "specversion": "1.0",
    "source": "glides.mbta.com",
    "id": "19fdb184-7dd6-4664-8472-04bd6177ec44",
    "time": "2024-11-14T11:02:00-04:00",
    "data": {
      "assignments": [
        {
          "vehicle": {
            "vehicleId": "G-12345",
            "carNumbers": ["3902", "3901"]
          },
          "tripKey": {
            "serviceDate": "2024-11-14",
            "tripId": "22222222",
            "scheduled": "scheduled",
            "revenue": "revenue"
          }
        }
      ]
    }
  },
  {
    "type": "com.mbta.ctd.glides.vehicle_trip_assignments.v1",
    "specversion": "1.0",
    "source": "glides.mbta.com",
    "id": "19fdb184-7dd6-4664-8472-04bd6177ec44",
    "time": "2024-11-14T11:55:00-04:00",
    "data": {
      "assignments": [
        {
          "vehicle": {
            "vehicleId": "G-12345",
            "carNumbers": null
          },
          "tripKey": null
        },
        {
          "vehicle": null,
          "tripKey": {
            "serviceDate": "2024-11-14",
            "tripId": "22222222",
            "scheduled": "scheduled",
            "revenue": "revenue"
          }
        }
      ]
    }
  }
]
